{
  "domains": [
    {"id": "product-management", "description": "Product management"}
  ],
  "actions": [
    {"id": "synthesize", "description": "Synthesize evidence"}
  ],
  "modalities": ["text"],
  "extensions": ["com.example.missions"],
  "extensionData": {
    "com.example.missions": {
      "version": "1.0.0",
      "payload": {
        "missions": ["signal-synthesis"]
      }
    }
  }
}
